{
  "branch": "feature/rate-limiting",
  "scopedFiles": [
    { "file": "src/middleware/rate-limiter.ts", "status": "reviewed", "source": "committed" },
    { "file": "src/middleware/auth.ts", "status": "skipped", "skipReason": "Out of scope for this review.", "source": "committed" }
  ],
  "suggestions": [
    {
      "file": "src/middleware/rate-limiter.ts",
      "line": 42,
      "quotedCode": "if (count > limit) return res.status(429).send('Too many requests');",
      "description": "Missing Retry-After header as required by RFC 6585.",
      "severity": "MEDIUM",
      "introduced": true
    }
  ],
  "verifications": [
    { "id": "V-001", "verdict": "PASS", "suggestion": 0, "notes": "Rate limiting blocks at correct threshold." },
    { "id": "V-002", "verdict": "SKIP", "notes": "Redis integration test skipped; mocked in unit tests." }
  ]
}
